{
  "query": "replace this",
  "name": "Incomplete referrals",
  "status": "published",
  "notes": "This report lists all patients that have a pending referral for the selected parameters.",
  "dbSchema": "reporting",
  "queryOptions": {
    "defaultDateRange": "allTime",
    "dataSources": [
      "thisFacility",
      "allFacilities"
    ],
    "parameters": [
      {
        "parameterField": "VillageField",
        "label": "Village",
        "name": "villageId"
      },
      {
        "parameterField": "PractitionerField",
        "label": "Doctor/Nurse",
        "name": "doctorId"
      }
    ]
  }
}
