{
  "query": "replace this",
  "name": "Medication Dispensed summary report",
  "notes": "This report shows quantity of medication dispensed for a given drug within a specified date range, based on actual dispense records.",
  "status": "published",
  "dbSchema": "reporting",
  "queryOptions": {
    "defaultDateRange": "30days",
    "dataSources": [
      "thisFacility",
      "allFacilities"
    ],
    "parameters": [
      {
        "parameterField": "FacilityField",
        "label": "Facility",
        "name": "facilityId",
        "filterBySelectedFacility": true
      },
      {
        "parameterField": "ParameterSuggesterSelectField",
        "label": "Drug",
        "name": "medicationId",
        "suggesterEndpoint": "drug"
      }
    ]
  }
}