{
  "query": "place query here",
  "name": "Imaging requests summary",
  "status": "published",
  "notes": "This report generates a statistical summary of imaging requests by date, department and imaging type. Each indicator is reported by day. Dates are listed chronologically by department and imaging type. Imaging requests with a status of cancelled, deleted or entered in error are excluded from this report. \n\nDetails on how each indicator is calculated are provided below:\n- Total new requests = The number of imaging requests generated on the specified day. \n- Total requests with a status of pending = The number of imaging requests with a status of pending. This number may include requests generated on a different date. \n- Total requests completed = The number of imaging requests with status updated to completed on the specified day. ",
  "dbSchema": "reporting",
  "queryOptions": {
    "defaultDateRange": "30days",
    "dataSources": [
      "thisFacility"
    ],
    "parameters": [
      {
        "parameterField": "FacilityField",
        "label": "Facility",
        "name": "facilityId",
        "filterBySelectedFacility": true
      },
      {
        "parameterField": "ParameterAutocompleteField",
        "label": "Department",
        "name": "department",
        "suggesterEndpoint": "department",
        "suggesterOptions": {
          "baseQueryParameters": {
            "filterByFacility": true
          }
        }
      },
      {
        "parameterField": "ImagingTypeField",
        "label": "Imaging type",
        "name": "imagingType"
      }
    ]
  }
}
