{
  "query": "replace this",
  "name": "Payment method line list",
  "notes": "This report generates a list of all patient payments. Each row in the report represents a single payment. The report includes patient, payment and payment method information. Payments are listed in chronological order by payment date.",
  "status": "published",
  "dbSchema": "reporting",
  "queryOptions": {
    "defaultDateRange": "allTime",
    "dateRangeLabel": "Enter payment dates (or leave it blank for all patient payments)",
    "dataSources": ["thisFacility", "allFacilities"],
    "parameters": [
      {
        "parameterField": "ParameterAutocompleteField",
        "label": "Payment method",
        "name": "methodId",
        "suggesterEndpoint": "paymentMethod"
      }
    ]
  }
}
