{
  "query": "replace this",
  "name": "Encounter invoice audit",
  "status": "published",
  "notes": "Audit report for reviewing invoices against encounters. The date range filters on encounter start date, so each row represents an encounter that started within the range. Use the 'Include in-progress encounters' filter (defaults to Yes) to include non-discharged encounters; included rows appear with an empty encounter end date. Test patients and sensitive facilities are excluded.\n\nColumns included:\n- Patient identification (ID, name, date of birth, age, sex, billing type).\n- Encounter start and end dates and times with length of stay.\n- Facility and discharging department.\n- Supervising clinician.\n- Invoice finalised date and time.\n- Invoice total — sum of price × quantity for all items on non-cancelled invoices.\n- Insurance coverage — calculated from insurance plan coverage percentages applied to insurable items on non-cancelled invoices. Uses finalised coverage values where available and falls back to current plan values for in-progress invoices.\n- Patient subtotal — invoice total minus insurance coverage minus invoice-level discount.\n- Patient payment — net patient payments (payments minus refunds) against non-cancelled invoices.\n- Patient total — patient subtotal minus patient payment (outstanding balance).\n- Invoice products with no category — items on non-cancelled invoices that have no product category assigned, which typically indicates manually added fees (e.g. encounter fees added outside the product catalogue) or products with a broken category reference.",
  "dbSchema": "reporting",
  "queryOptions": {
    "defaultDateRange": "7days",
    "dateRangeLabel": "Encounter start date range",
    "dataSources": [
      "thisFacility",
      "allFacilities"
    ],
    "parameters": [
      {
        "parameterField": "FacilityField",
        "label": "Facility",
        "name": "facilityId",
        "filterBySelectedFacility": true
      },
      {
        "parameterField": "ParameterAutocompleteField",
        "label": "Department",
        "name": "departmentId",
        "suggesterEndpoint": "department",
        "suggesterOptions": {
          "baseQueryParameters": {
            "filterByFacility": true
          }
        }
      },
      {
        "parameterField": "ParameterAutocompleteField",
        "label": "Patient billing type",
        "name": "patientBillingTypeId",
        "suggesterEndpoint": "patientBillingType"
      },
      {
        "parameterField": "ParameterAutocompleteField",
        "label": "Supervising clinician",
        "name": "supervisingClinicianId",
        "suggesterEndpoint": "practitioner"
      },
      {
        "parameterField": "ParameterSelectField",
        "label": "Include in-progress encounters (default Yes)",
        "name": "includeOpenEncounters",
        "options": [
          {
            "label": "Yes",
            "value": "yes"
          },
          {
            "label": "No",
            "value": "no"
          }
        ]
      }
    ]
  }
}
