{
  "query": "replace this",
  "name": "Registered birth line list",
  "notes": "This report generates a list of all registered births for the selected parameters. Patients are listed in chronological order by date and time of birth. The report also includes key demographic information and birth details for each patient.",
  "status": "published",
  "dbSchema": "reporting",
  "queryOptions": {
    "defaultDateRange": "7days",
    "dataSources": ["thisFacility", "allFacilities"],
    "parameters": [
      {
        "parameterField": "FacilityField",
        "label": "Facility",
        "name": "facilityId",
        "filterBySelectedFacility": true
      },
      {
        "parameterField": "VillageField",
        "label": "Village",
        "name": "villageId"
      }
    ]
  }
}
